{
  "irVersion": "1.0",
  "kind": "epoch_end",
  "ts": 1773000005000,
  "sessionId": "sess_001",
  "runtimeId": "js_client",
  "runtime": {
    "host": "browser",
    "engine": "tfjs",
    "backend": "webgl",
    "transport": "inproc"
  },
  "status": {
    "state": "running",
    "message": "Epoch 3 complete."
  },
  "metrics": {
    "epoch": 3,
    "train_loss": 0.00121,
    "val_loss": 0.00155,
    "lr": 0.0005,
    "best_val_loss": 0.00155,
    "improved": true
  }
}
